{
  "schemaVersion": 1,
  "packId": "biblical-ages-core",
  "title": "Biblical Ages Core",
  "version": "0.1.0",
  "license": "TBD",
  "persons": [
    {
      "id": "person.adam",
      "primaryName": "Adam",
      "aliases": [],
      "gender": "male",
      "tribes": [],
      "roles": ["first-human", "ancestor"],
      "keyReferences": ["gen2.7", "gen5.1-5", "luk3.38"],
      "notes": [],
      "confidence": "high"
    },
    {
      "id": "person.noah",
      "primaryName": "Noah",
      "aliases": [],
      "gender": "male",
      "tribes": [],
      "roles": ["patriarch", "ancestor"],
      "keyReferences": ["gen6.9", "gen9.1", "gen10.1"],
      "notes": [],
      "confidence": "high"
    },
    {
      "id": "person.shem",
      "primaryName": "Shem",
      "aliases": [],
      "gender": "male",
      "tribes": [],
      "roles": ["ancestor"],
      "keyReferences": ["gen10.21", "gen11.10"],
      "notes": [],
      "confidence": "high"
    },
    {
      "id": "person.abraham",
      "primaryName": "Abraham",
      "aliases": ["Abram"],
      "gender": "male",
      "tribes": [],
      "roles": ["patriarch", "covenant-recipient"],
      "keyReferences": ["gen12.1-9", "gen15.6", "gen17.5"],
      "notes": [],
      "confidence": "high"
    },
    {
      "id": "person.sarah",
      "primaryName": "Sarah",
      "aliases": ["Sarai"],
      "gender": "female",
      "tribes": [],
      "roles": ["matriarch"],
      "keyReferences": ["gen17.15-16", "gen21.1-3"],
      "notes": [],
      "confidence": "high"
    },
    {
      "id": "person.isaac",
      "primaryName": "Isaac",
      "aliases": [],
      "gender": "male",
      "tribes": [],
      "roles": ["patriarch"],
      "keyReferences": ["gen21.3", "gen26.2-5"],
      "notes": [],
      "confidence": "high"
    },
    {
      "id": "person.rebekah",
      "primaryName": "Rebekah",
      "aliases": [],
      "gender": "female",
      "tribes": [],
      "roles": ["matriarch"],
      "keyReferences": ["gen24.67", "gen25.21-26"],
      "notes": [],
      "confidence": "high"
    },
    {
      "id": "person.jacob",
      "primaryName": "Jacob",
      "aliases": ["Israel"],
      "gender": "male",
      "tribes": [],
      "roles": ["patriarch", "tribal-ancestor"],
      "keyReferences": ["gen25.26", "gen32.28", "gen35.22-26"],
      "notes": [],
      "confidence": "high"
    },
    {
      "id": "person.esau",
      "primaryName": "Esau",
      "aliases": ["Edom"],
      "gender": "male",
      "tribes": [],
      "roles": ["ancestor"],
      "keyReferences": ["gen25.25", "gen36.1"],
      "notes": [],
      "confidence": "high"
    },
    {
      "id": "person.leah",
      "primaryName": "Leah",
      "aliases": [],
      "gender": "female",
      "tribes": [],
      "roles": ["matriarch"],
      "keyReferences": ["gen29.23", "gen35.23"],
      "notes": [],
      "confidence": "high"
    },
    {
      "id": "person.rachel",
      "primaryName": "Rachel",
      "aliases": [],
      "gender": "female",
      "tribes": [],
      "roles": ["matriarch"],
      "keyReferences": ["gen29.28", "gen35.24"],
      "notes": [],
      "confidence": "high"
    },
    {
      "id": "person.judah",
      "primaryName": "Judah",
      "aliases": [],
      "gender": "male",
      "tribes": ["Judah"],
      "roles": ["tribal-ancestor"],
      "keyReferences": ["gen35.23", "gen49.8-12", "rut4.12"],
      "notes": [],
      "confidence": "high"
    },
    {
      "id": "person.joseph",
      "primaryName": "Joseph",
      "aliases": [],
      "gender": "male",
      "tribes": [],
      "roles": ["patriarchal-son"],
      "keyReferences": ["gen30.24", "gen37.2", "gen50.20"],
      "notes": [],
      "confidence": "high"
    },
    {
      "id": "person.david",
      "primaryName": "David",
      "aliases": [],
      "gender": "male",
      "tribes": ["Judah"],
      "roles": ["king", "covenant-recipient"],
      "keyReferences": ["rut4.17", "2sa7.12-16", "mat1.6"],
      "notes": [],
      "confidence": "high"
    },
    {
      "id": "person.jesus",
      "primaryName": "Jesus",
      "aliases": ["Jesus Christ"],
      "gender": "male",
      "tribes": ["Judah"],
      "roles": ["messiah", "son-of-david"],
      "keyReferences": ["mat1.1", "luk1.32-33", "rev22.16"],
      "notes": [],
      "confidence": "high"
    }
  ],
  "relationships": [
    {
      "id": "rel.adam.noah.ancestor",
      "type": "ancestor_descendant",
      "fromPersonId": "person.adam",
      "toPersonId": "person.noah",
      "references": ["gen5.1-32"],
      "certainty": "compressed",
      "notes": ["Modeled as ancestor/descendant for starter-pack scale. Direct generation edges can be expanded later."]
    },
    {
      "id": "rel.noah.shem.parent",
      "type": "parent_child",
      "fromPersonId": "person.noah",
      "toPersonId": "person.shem",
      "references": ["gen10.1"],
      "certainty": "explicit",
      "notes": []
    },
    {
      "id": "rel.shem.abraham.ancestor",
      "type": "ancestor_descendant",
      "fromPersonId": "person.shem",
      "toPersonId": "person.abraham",
      "references": ["gen11.10-26"],
      "certainty": "compressed",
      "notes": []
    },
    {
      "id": "rel.abraham.sarah.spouse",
      "type": "spouse",
      "fromPersonId": "person.abraham",
      "toPersonId": "person.sarah",
      "references": ["gen17.15-16"],
      "certainty": "explicit",
      "notes": []
    },
    {
      "id": "rel.abraham.isaac.parent",
      "type": "parent_child",
      "fromPersonId": "person.abraham",
      "toPersonId": "person.isaac",
      "references": ["gen21.3"],
      "certainty": "explicit",
      "notes": []
    },
    {
      "id": "rel.sarah.isaac.parent",
      "type": "parent_child",
      "fromPersonId": "person.sarah",
      "toPersonId": "person.isaac",
      "references": ["gen21.1-3"],
      "certainty": "explicit",
      "notes": []
    },
    {
      "id": "rel.isaac.rebekah.spouse",
      "type": "spouse",
      "fromPersonId": "person.isaac",
      "toPersonId": "person.rebekah",
      "references": ["gen24.67"],
      "certainty": "explicit",
      "notes": []
    },
    {
      "id": "rel.isaac.jacob.parent",
      "type": "parent_child",
      "fromPersonId": "person.isaac",
      "toPersonId": "person.jacob",
      "references": ["gen25.26"],
      "certainty": "explicit",
      "notes": []
    },
    {
      "id": "rel.rebekah.jacob.parent",
      "type": "parent_child",
      "fromPersonId": "person.rebekah",
      "toPersonId": "person.jacob",
      "references": ["gen25.21-26"],
      "certainty": "explicit",
      "notes": []
    },
    {
      "id": "rel.isaac.esau.parent",
      "type": "parent_child",
      "fromPersonId": "person.isaac",
      "toPersonId": "person.esau",
      "references": ["gen25.25"],
      "certainty": "explicit",
      "notes": []
    },
    {
      "id": "rel.rebekah.esau.parent",
      "type": "parent_child",
      "fromPersonId": "person.rebekah",
      "toPersonId": "person.esau",
      "references": ["gen25.21-25"],
      "certainty": "explicit",
      "notes": []
    },
    {
      "id": "rel.jacob.leah.spouse",
      "type": "spouse",
      "fromPersonId": "person.jacob",
      "toPersonId": "person.leah",
      "references": ["gen29.23"],
      "certainty": "explicit",
      "notes": []
    },
    {
      "id": "rel.jacob.rachel.spouse",
      "type": "spouse",
      "fromPersonId": "person.jacob",
      "toPersonId": "person.rachel",
      "references": ["gen29.28"],
      "certainty": "explicit",
      "notes": []
    },
    {
      "id": "rel.jacob.judah.parent",
      "type": "parent_child",
      "fromPersonId": "person.jacob",
      "toPersonId": "person.judah",
      "references": ["gen35.23"],
      "certainty": "explicit",
      "notes": []
    },
    {
      "id": "rel.leah.judah.parent",
      "type": "parent_child",
      "fromPersonId": "person.leah",
      "toPersonId": "person.judah",
      "references": ["gen35.23"],
      "certainty": "explicit",
      "notes": []
    },
    {
      "id": "rel.jacob.joseph.parent",
      "type": "parent_child",
      "fromPersonId": "person.jacob",
      "toPersonId": "person.joseph",
      "references": ["gen35.24"],
      "certainty": "explicit",
      "notes": []
    },
    {
      "id": "rel.rachel.joseph.parent",
      "type": "parent_child",
      "fromPersonId": "person.rachel",
      "toPersonId": "person.joseph",
      "references": ["gen35.24"],
      "certainty": "explicit",
      "notes": []
    },
    {
      "id": "rel.judah.david.ancestor",
      "type": "ancestor_descendant",
      "fromPersonId": "person.judah",
      "toPersonId": "person.david",
      "references": ["rut4.18-22", "mat1.2-6"],
      "certainty": "compressed",
      "notes": ["Ruth 4 records intermediate names; starter pack keeps the lineage collapsed until those records are expanded."]
    },
    {
      "id": "rel.david.jesus.lineage-matthew",
      "type": "lineage_claim",
      "fromPersonId": "person.david",
      "toPersonId": "person.jesus",
      "references": ["mat1.1-17"],
      "certainty": "compressed",
      "notes": ["Matthew 1 is retained as its own genealogy tradition."]
    },
    {
      "id": "rel.david.jesus.lineage-luke",
      "type": "lineage_claim",
      "fromPersonId": "person.david",
      "toPersonId": "person.jesus",
      "references": ["luk3.23-38"],
      "certainty": "compressed",
      "notes": ["Luke 3 is retained as its own genealogy tradition."]
    }
  ],
  "events": [
    {
      "id": "event.call-of-abram",
      "title": "Call of Abram",
      "kind": "calling",
      "date": {
        "kind": "relative",
        "label": "Patriarchal period",
        "confidence": "medium",
        "basis": "explicit_text",
        "sourceIds": ["source.genesis-patriarchs"]
      },
      "personIds": ["person.abraham", "person.sarah"],
      "ageIds": ["age.patriarchs"],
      "references": ["gen12.1-9"],